{
    "headline": "Lorem ipsum dolor sit amet, consectetur adipisicing elit.",
    "text": "Aut, distinctio esse voluptates? Nobis molestiae ducimus sequi illum laudantium reiciendis architecto tempore sapiente perferendis dolore nisi odit et, nostrum alias recusandae?",
    "cta": {
        "href": "http://redhat.com",
        "text": "Learn More",
        "title": "Click me!"
    },
    "name": "promo"
}
